[
  {
    "title": "Convergence Manifesto v3",
    "ics": "ICS-2025-MANIFESTO",
    "date": "2025-05-26",
    "link": "manifesto_v3.pdf"
  },
  {
    "title": "Certified Document 1",
    "ics": "ICS-2025-0001",
    "date": "2025-05-24",
    "link": "doc1.pdf"
  },
  {
    "title": "Certified Document 2",
    "ics": "ICS-2025-0002",
    "date": "2025-05-25",
    "link": "doc2.pdf"
  }
]